{
  "schemaVersion": 1,
  "app": "assessment",
  "webVersion": "1.6.0",
  "servicePrefixes": {
    "identity": [
      "/auth",
      "/sso",
      "/users",
      "/profiles",
      "/roles",
      "/permissions",
      "/school-units",
      "/religions",
      "/blood-types",
      "/regions"
    ],
    "assessment": [
      "/assessment-items",
      "/assessment-weights",
      "/attendances",
      "/dashboards",
      "/exam-scores",
      "/rapors",
      "/student-scores"
    ],
    "exam": [
      "/exam-files",
      "/exam-grading",
      "/exam-imports",
      "/exam-packages",
      "/exam-questions",
      "/exam-schedules",
      "/exam-sessions",
      "/me/exams",
      "/student-exams"
    ],
    "academic": [
      "/academic-years",
      "/classrooms",
      "/grades",
      "/semesters",
      "/subjects",
      "/teaching-assignments"
    ],
    "student": [
      "/students",
      "/student-enrollments"
    ]
  },
  "unroutedPrefixes": [],
  "healthRoutes": [
    {
      "path": "/health/identity",
      "service": "identity"
    },
    {
      "path": "/health/assessment",
      "service": "assessment"
    },
    {
      "path": "/health/exam",
      "service": "exam"
    },
    {
      "path": "/health/academic",
      "service": "academic"
    },
    {
      "path": "/health/student",
      "service": "student"
    }
  ]
}
