{
  "schemaVersion": 1,
  "app": "admission",
  "webVersion": "1.0.0",
  "servicePrefixes": {
    "identity": [
      "/auth",
      "/sso",
      "/users",
      "/profiles",
      "/religions",
      "/blood-types",
      "/regions"
    ],
    "academic": [
      "/academic-years"
    ],
    "admission": [
      "/admissions"
    ]
  },
  "unroutedPrefixes": [
    "/settings"
  ],
  "healthRoutes": [
    {
      "path": "/health/identity",
      "service": "identity"
    },
    {
      "path": "/health/academic",
      "service": "academic"
    },
    {
      "path": "/health/admission",
      "service": "admission"
    }
  ]
}
